{
  "id": "gym_marker_cut",
  "pillar": "fitness",
  "title": "Marker cut",
  "premise": "Hand-lettered words in white and hot red over the hardest cutting in the set. Short, loud and finished before it outstays itself.",
  "target_seconds": 16,
  "chronological": false,
  "loop": false,
  "text_mode": "lyrics",
  "letterbox": 1.7777777777777777,
  "style": "marker",
  "song": {
    "tempo": [
      95,
      125
    ],
    "aggression": [
      0.3,
      0.9
    ],
    "energy_variance": [
      0.2,
      1.0
    ],
    "needs_drop": true,
    "payoff_at": 0.62
  },
  "copy": {
    "hook": "",
    "labels": [],
    "cta": ""
  },
  "notes": [
    "Measured off Gym-Inspiration/gym_3.MP4: 23 cuts in 15.7s — the shortest and hardest-cut of the four — with a seven-cut burst at 6.0-7.3s whose fastest fragment is two frames.",
    "The accent red is #F12109, measured on an eroded glyph core so it is the ink itself and not an anti-aliased edge. It is the only fully saturated colour anywhere in this system.",
    "That reel puts a true photographic negative inside its burst for 0.07s. negate_flash is on the burst slot here for the same reason."
  ],
  "shots": [
    {
      "id": "hook",
      "role": "hook",
      "weight": 0.55,
      "max_seconds": 2.0,
      "must_have": true,
      "what": "You walking into the empty gym, from behind, low angle, hard rim light down one side",
      "framing": "wide",
      "camera": "follow",
      "subject": "required",
      "motion": "medium",
      "on_section": "any",
      "shoot": "Low, below waist height, looking up. Backlight only — a rim on the shoulders is what survives the grade. Walk away from the lens, not towards it."
    },
    {
      "id": "promise",
      "role": "promise",
      "weight": 0.6,
      "must_have": true,
      "what": "Mid-shot, you setting up, still. The frame is mostly dark and mostly empty.",
      "framing": "medium",
      "camera": "static",
      "subject": "required",
      "motion": "still",
      "on_section": "any",
      "shoot": "Hold four seconds without moving. Empty space on one side of frame is not wasted — it is where the words go."
    },
    {
      "id": "detail_grip",
      "role": "build",
      "weight": 0.45,
      "what": "Hands on the bar, chalk, the knurl",
      "framing": "detail",
      "camera": "push_in",
      "subject": "optional",
      "motion": "low",
      "on_section": "build",
      "shoot": "Close enough that the hand fills a third of frame. This is one of the shots that will carry a matte, so keep the background darker than the hand."
    },
    {
      "id": "back_wide",
      "role": "build",
      "weight": 0.7,
      "what": "You from directly behind, arms out, filling the centre of frame",
      "framing": "medium",
      "camera": "static",
      "subject": "required",
      "motion": "low",
      "on_section": "build",
      "shoot": "The single most useful shot in this blueprint. A large, clean, centred silhouette is what makes text-behind-subject read at all."
    },
    {
      "id": "burst",
      "role": "build",
      "weight": 0.55,
      "what": "The working set — any angle, as long as something moves in every frame",
      "framing": "close",
      "camera": "handheld",
      "subject": "required",
      "motion": "high",
      "on_section": "build",
      "burst": {
        "cuts": 7,
        "negate": true
      },
      "shoot": "This slot is cut into seven fragments, the fastest of them two frames, with one inverted. Every fragment needs visible motion. Shoot one long continuous take, not seven.",
      "max_seconds": 1.8
    },
    {
      "id": "strain",
      "role": "build",
      "weight": 0.6,
      "what": "The rep at its hardest — the face, the veins, the bar bending",
      "framing": "close",
      "camera": "static",
      "subject": "required",
      "motion": "high",
      "on_section": "build",
      "shoot": "Get in close and stay there. Two takes minimum."
    },
    {
      "id": "feet",
      "role": "build",
      "weight": 0.4,
      "what": "Low detail — shoes, the plate on the floor, dust",
      "framing": "detail",
      "camera": "static",
      "subject": "optional",
      "motion": "low",
      "on_section": "build",
      "shoot": "Camera on the floor. A pattern interrupt that costs nothing to shoot."
    },
    {
      "id": "payoff",
      "role": "payoff",
      "weight": 0.85,
      "must_have": true,
      "what": "The finish — you standing up out of it, arms wide, everything released",
      "framing": "medium",
      "camera": "pull_out",
      "subject": "required",
      "motion": "high",
      "on_section": "drop",
      "shoot": "Shoot at 4K60 so this can be ramped down into a hold. The references decelerate into their payoff rather than speeding into it, and that is what makes it land."
    },
    {
      "id": "hold",
      "role": "payoff",
      "weight": 0.65,
      "what": "You holding still afterwards, breathing, half-lit",
      "framing": "close",
      "camera": "static",
      "subject": "required",
      "motion": "low",
      "on_section": "sustain",
      "shoot": "Let it run long. This is where the last words of the lyric sit."
    },
    {
      "id": "close",
      "role": "cta",
      "weight": 0.5,
      "what": "Back to the opening framing — you walking out, or the empty room",
      "framing": "wide",
      "camera": "static",
      "subject": "optional",
      "motion": "low",
      "on_section": "outro",
      "shoot": "Match the hook's framing so the loop closes invisibly. Same lens, same height, same wall."
    }
  ],
  "grade": "night",
  "subject_dodge": true
}
